{
  "contractVersion": 2,
  "hyprland": {
    "reviewedVersion": "0.56.2",
    "reviewedTag": "v0.56.2",
    "reviewedCommit": "efb50993780079460b0cbed1363e2166a2de1d9f",
    "minimumPatch": 2,
    "maximumPatch": 2
  },
  "sourceManifestDigest": "f67f9214c47770268e66dd43d94b3af68dcbcac701312edcd52eedffb157f60d",
  "configSchemaDigest": "b3520bcbdb3fece0fa6ea262a0d48ac0d081a06ca493c03ce0f91cf003a23e13",
  "source": {
    "repository": "https://github.com/hyprwm/Hyprland",
    "tag": "v0.56.2",
    "commit": "efb50993780079460b0cbed1363e2166a2de1d9f",
    "path": "src/config/lua/bindings/LuaBindingsDispatchers.cpp",
    "sha256": "a109eeb982856e0fe2ac9d88c29115a09984511787e19a20e7b4804e14a9d4de"
  },
  "dispatcherActions": [
    {
      "id": "cursor.move",
      "label": "Cursor Move",
      "description": "Move the pointer to exact compositor coordinates.",
      "luaPath": [
        "dsp",
        "cursor",
        "move"
      ],
      "invocation": {
        "kind": "table"
      },
      "uiTier": "advanced",
      "risk": "safe",
      "argumentsSchemaRef": "config.schema.json#/$defs/cursorMoveArguments",
      "documentation": "https://wiki.hypr.land/0.56.0/Configuring/Basics/Binds/"
    },
    {
      "id": "cursor.move_to_corner",
      "label": "Cursor Move To Corner",
      "description": "Move the pointer to a selected corner of the focused window.",
      "luaPath": [
        "dsp",
        "cursor",
        "move_to_corner"
      ],
      "invocation": {
        "kind": "table"
      },
      "uiTier": "advanced",
      "risk": "safe",
      "argumentsSchemaRef": "config.schema.json#/$defs/cursorCornerArguments",
      "documentation": "https://wiki.hypr.land/0.56.0/Configuring/Basics/Binds/"
    },
    {
      "id": "dpms",
      "label": "DPMS",
      "description": "Toggle, enable, or disable display power management.",
      "luaPath": [
        "dsp",
        "dpms"
      ],
      "invocation": {
        "kind": "table"
      },
      "uiTier": "advanced",
      "risk": "caution",
      "argumentsSchemaRef": "config.schema.json#/$defs/dpmsArguments",
      "documentation": "https://wiki.hypr.land/0.56.0/Configuring/Basics/Binds/"
    },
    {
      "id": "event",
      "label": "Event",
      "description": "Emit a custom Hyprland IPC event.",
      "luaPath": [
        "dsp",
        "event"
      ],
      "invocation": {
        "kind": "scalar",
        "field": "event"
      },
      "uiTier": "expert",
      "risk": "caution",
      "argumentsSchemaRef": "config.schema.json#/$defs/eventArguments",
      "documentation": "https://wiki.hypr.land/0.56.0/Configuring/Basics/Binds/"
    },
    {
      "id": "exit",
      "label": "Exit",
      "description": "Exit the running Hyprland session.",
      "luaPath": [
        "dsp",
        "exit"
      ],
      "invocation": {
        "kind": "none"
      },
      "uiTier": "advanced",
      "risk": "dangerous",
      "argumentsSchemaRef": "config.schema.json#/$defs/emptyArguments",
      "documentation": "https://wiki.hypr.land/0.56.0/Configuring/Basics/Binds/"
    },
    {
      "id": "focus",
      "label": "Focus",
      "description": "Focus a window, workspace, monitor, direction, urgent target, or prior target.",
      "luaPath": [
        "dsp",
        "focus"
      ],
      "invocation": {
        "kind": "table"
      },
      "uiTier": "advanced",
      "risk": "safe",
      "argumentsSchemaRef": "config.schema.json#/$defs/focusArguments",
      "documentation": "https://wiki.hypr.land/0.56.0/Configuring/Basics/Binds/"
    },
    {
      "id": "force_idle",
      "label": "Force Idle",
      "description": "Advance idle timers by a specified number of seconds.",
      "luaPath": [
        "dsp",
        "force_idle"
      ],
      "invocation": {
        "kind": "scalar",
        "field": "seconds"
      },
      "uiTier": "advanced",
      "risk": "safe",
      "argumentsSchemaRef": "config.schema.json#/$defs/forceIdleArguments",
      "documentation": "https://wiki.hypr.land/0.56.0/Configuring/Basics/Binds/"
    },
    {
      "id": "force_renderer_reload",
      "label": "Force Renderer Reload",
      "description": "Force Hyprland to reload renderer resources.",
      "luaPath": [
        "dsp",
        "force_renderer_reload"
      ],
      "invocation": {
        "kind": "none"
      },
      "uiTier": "expert",
      "risk": "caution",
      "argumentsSchemaRef": "config.schema.json#/$defs/emptyArguments",
      "documentation": "https://wiki.hypr.land/0.56.0/Configuring/Basics/Binds/"
    },
    {
      "id": "global",
      "label": "Global",
      "description": "Invoke a registered global shortcut.",
      "luaPath": [
        "dsp",
        "global"
      ],
      "invocation": {
        "kind": "scalar",
        "field": "name"
      },
      "uiTier": "expert",
      "risk": "caution",
      "argumentsSchemaRef": "config.schema.json#/$defs/globalArguments",
      "documentation": "https://wiki.hypr.land/0.56.0/Configuring/Basics/Binds/"
    },
    {
      "id": "group.active",
      "label": "Group Active",
      "description": "Activate a window at a specific index in the current group.",
      "luaPath": [
        "dsp",
        "group",
        "active"
      ],
      "invocation": {
        "kind": "table"
      },
      "uiTier": "advanced",
      "risk": "safe",
      "argumentsSchemaRef": "config.schema.json#/$defs/groupActiveArguments",
      "documentation": "https://wiki.hypr.land/0.56.0/Configuring/Basics/Binds/"
    },
    {
      "id": "group.lock",
      "label": "Group Lock",
      "description": "Toggle, enable, or disable global window-group locking.",
      "luaPath": [
        "dsp",
        "group",
        "lock"
      ],
      "invocation": {
        "kind": "table"
      },
      "uiTier": "advanced",
      "risk": "safe",
      "argumentsSchemaRef": "config.schema.json#/$defs/toggleArguments",
      "documentation": "https://wiki.hypr.land/0.56.0/Configuring/Basics/Binds/"
    },
    {
      "id": "group.lock_active",
      "label": "Group Lock Active",
      "description": "Toggle, enable, or disable locking for the active window group.",
      "luaPath": [
        "dsp",
        "group",
        "lock_active"
      ],
      "invocation": {
        "kind": "table"
      },
      "uiTier": "advanced",
      "risk": "safe",
      "argumentsSchemaRef": "config.schema.json#/$defs/toggleArguments",
      "documentation": "https://wiki.hypr.land/0.56.0/Configuring/Basics/Binds/"
    },
    {
      "id": "group.move_window",
      "label": "Group Move Window",
      "description": "Reorder the active window forward or backward within its group.",
      "luaPath": [
        "dsp",
        "group",
        "move_window"
      ],
      "invocation": {
        "kind": "table"
      },
      "uiTier": "advanced",
      "risk": "safe",
      "argumentsSchemaRef": "config.schema.json#/$defs/groupMoveWindowArguments",
      "documentation": "https://wiki.hypr.land/0.56.0/Configuring/Basics/Binds/"
    },
    {
      "id": "group.next",
      "label": "Group Next",
      "description": "Activate the next window in the current group.",
      "luaPath": [
        "dsp",
        "group",
        "next"
      ],
      "invocation": {
        "kind": "none"
      },
      "uiTier": "advanced",
      "risk": "safe",
      "argumentsSchemaRef": "config.schema.json#/$defs/emptyArguments",
      "documentation": "https://wiki.hypr.land/0.56.0/Configuring/Basics/Binds/"
    },
    {
      "id": "group.prev",
      "label": "Group Prev",
      "description": "Activate the previous window in the current group.",
      "luaPath": [
        "dsp",
        "group",
        "prev"
      ],
      "invocation": {
        "kind": "none"
      },
      "uiTier": "advanced",
      "risk": "safe",
      "argumentsSchemaRef": "config.schema.json#/$defs/emptyArguments",
      "documentation": "https://wiki.hypr.land/0.56.0/Configuring/Basics/Binds/"
    },
    {
      "id": "group.toggle",
      "label": "Group Toggle",
      "description": "Toggle the active window's membership in a window group.",
      "luaPath": [
        "dsp",
        "group",
        "toggle"
      ],
      "invocation": {
        "kind": "none"
      },
      "uiTier": "advanced",
      "risk": "safe",
      "argumentsSchemaRef": "config.schema.json#/$defs/emptyArguments",
      "documentation": "https://wiki.hypr.land/0.56.0/Configuring/Basics/Binds/"
    },
    {
      "id": "no_op",
      "label": "No Op",
      "description": "Perform no compositor action.",
      "luaPath": [
        "dsp",
        "no_op"
      ],
      "invocation": {
        "kind": "none"
      },
      "uiTier": "advanced",
      "risk": "safe",
      "argumentsSchemaRef": "config.schema.json#/$defs/emptyArguments",
      "documentation": "https://wiki.hypr.land/0.56.0/Configuring/Basics/Binds/"
    },
    {
      "id": "pass",
      "label": "Pass",
      "description": "Pass the current key event to a selected window.",
      "luaPath": [
        "dsp",
        "pass"
      ],
      "invocation": {
        "kind": "table"
      },
      "uiTier": "advanced",
      "risk": "caution",
      "argumentsSchemaRef": "config.schema.json#/$defs/passArguments",
      "documentation": "https://wiki.hypr.land/0.56.0/Configuring/Basics/Binds/"
    },
    {
      "id": "release_input_capture",
      "label": "Release Input Capture",
      "description": "Release the active input-capture session.",
      "luaPath": [
        "dsp",
        "release_input_capture"
      ],
      "invocation": {
        "kind": "none"
      },
      "uiTier": "expert",
      "risk": "caution",
      "argumentsSchemaRef": "config.schema.json#/$defs/emptyArguments",
      "documentation": "https://wiki.hypr.land/0.56.0/Configuring/Basics/Binds/"
    },
    {
      "id": "send_key_state",
      "label": "Send Key State",